sentence,cluster,title,cluster_label
"Instagram: https://www.instagram.com/dwnews
?",38,Video captures moment Air India flight crashes | DW News,"facebook, com, https, instagram, https www"
"TikTok: https://www.tiktok.com/@dwnews
?",38,Video captures moment Air India flight crashes | DW News,"facebook, com, https, instagram, https www"
"Facebook: https://www.facebook.com/deutschewellenews/
?",38,Video captures moment Air India flight crashes | DW News,"facebook, com, https, instagram, https www"
"CBS News 24/7 is the premier anchored streaming news service from CBS News and Stations that is available free to everyone with access to the internet and is the destination for breaking news, live events, original reporting and storytelling, and programs from CBS News and Stations' top anchors and correspondents working locally, nationally and around the globe.",37,Video shows Air India plane crashing in Ahmedabad,"news, republic, com, https, watch"
"It is available on more than 30 platforms across mobile, desktop and connected TVs for free, as well as CBSNews.com and Paramount+ and live in 91 countries.",37,Video shows Air India plane crashing in Ahmedabad,"news, republic, com, https, watch"
"Subscribe to the CBS News YouTube channel: https://youtube.com/cbsnews
Watch CBS News 24/7: https://cbsnews.com/live/
Download the CBS News app: https://cbsnews.com/mobile/
Follow CBS News on Instagram: https://instagram.com/cbsnews/
Like CBS News on Facebook: https://facebook.com/cbsnews
Follow CBS News on X: https://twitter.com/cbsnews
Subscribe to our newsletters: https://cbsnews.com/newsletters/
Try Paramount+ free: https://paramountplus.com/?ftag=PPM-05-10aeh8h

For video licensing inquiries, contact: licensing@veritone.com",37,Video shows Air India plane crashing in Ahmedabad,"news, republic, com, https, watch"
"On: https://www.republicworld.com

Republic TV is India's no.1 English news channel since its launch.",37,Ahmedabad Plane Crash: 2nd Black Box Recovered Of Air India Flight AI 171 From Crash Site,"news, republic, com, https, watch"
"Watch Republic YouTube Channel to get all the breaking news updates, LIVE news, videos and perspectives from Republic Media Network's battery of reporters, anchors, and producers spread across India and the world.",37,Ahmedabad Plane Crash: 2nd Black Box Recovered Of Air India Flight AI 171 From Crash Site,"news, republic, com, https, watch"
Republic TV makes news accessible at all times and across devices.,37,Ahmedabad Plane Crash: 2nd Black Box Recovered Of Air India Flight AI 171 From Crash Site,"news, republic, com, https, watch"
"At Republic, we keep you updated with up-to-the-minute news on the world of politics, sports, entertainment, business, defense, science, health, lifestyle, gadgets, and much more.",37,Ahmedabad Plane Crash: 2nd Black Box Recovered Of Air India Flight AI 171 From Crash Site,"news, republic, com, https, watch"
"But most importantly, for us ?You Are Republic, We Are Your Voice.?

Also, Watch ?",37,Ahmedabad Plane Crash: 2nd Black Box Recovered Of Air India Flight AI 171 From Crash Site,"news, republic, com, https, watch"
Republic TV Live News Updates ?,37,Ahmedabad Plane Crash: 2nd Black Box Recovered Of Air India Flight AI 171 From Crash Site,"news, republic, com, https, watch"
"https://bit.ly/34isZdh

You can stay connected with Republic TV on -

Facebook - https://www.facebook.com/RepublicWorld
Twitter - https://twitter.com/republic
Instagram:",37,Ahmedabad Plane Crash: 2nd Black Box Recovered Of Air India Flight AI 171 From Crash Site,"news, republic, com, https, watch"
"https://www.instagram.com/republicworld
WhatsApp Channel: https://whatsapp.com/channel/0029Va1whYb7dmeZr7v3ar0y
Telegram: https://t.me/RepublicLive

Disclaimer: Republic Media Network may provide content through third-party websites, operating systems, platforms, and portals (?Third-Party Platforms?).",37,Ahmedabad Plane Crash: 2nd Black Box Recovered Of Air India Flight AI 171 From Crash Site,"news, republic, com, https, watch"
"Republic does not control and has no liability for Third-Party Platforms, including content hosted, advertisements, security, functionality, operation, or availability.",37,Ahmedabad Plane Crash: 2nd Black Box Recovered Of Air India Flight AI 171 From Crash Site,"news, republic, com, https, watch"
"[https://twitter.com/newscomauHQ]
???????????????????????????
Subscribe To Our YouTube Channel
For The Very Latest News From Australia And Around The World:
?",37,More than 200 dead in Air India crash near Ahmedabad,"news, republic, com, https, watch"
"Watch big political debates, exclusive entertainment interviews, news bulletins, current affairs, talk shows and tech reviews with our 24x7 news live streams, packed with credible information across all platforms: TV, Internet and Mobile.",37,"Ahmedabad Plane Crash | CCTV Video Shows Air India Flight Trying To Take Off, Crashing Into Building","news, republic, com, https, watch"
"???

Subscribe to ABC News on YouTube: https://abcnews.visitlink.me/59aJ1G

ABC News is your daily source of breaking national and world news, exclusive interviews and 24/7 live streaming coverage.",37,"British national survives Air India plane crash, condition unknown","news, republic, com, https, watch"
"Download the ABC News app for the latest headlines and alerts: https://abcnews.go.com/devices

Watch 24/7 coverage of breaking news and live events on ABC News Live: https://www.youtube.com/watch?v=gN0PZCe-kwQ&ab_channel=ABCNews 

Watch full episodes of World News Tonight with David Muir here: https://youtube.com/playlist?list=PLQOa26lW-uI8ixlVw1NWu_l4Eh8iZW_qN&feature=shared 

Read ABC News reports online: http://abcnews.go.com

ABC News is the home to the #1 evening newscast ?World News",37,"British national survives Air India plane crash, condition unknown","news, republic, com, https, watch"
"Tonight with David Muir,"" ?Good Morning America,? ?20/20,? ?Nightline,? ?This Week? with George Stephanopoulos, ?ABC News Live Prime? with Linsey Davis, plus the daily news podcast ?Start Here.?

Connect with ABC News on social media:",37,"British national survives Air India plane crash, condition unknown","news, republic, com, https, watch"
"Don?t expect a 24/7 stream of news, we are not that channel.",37,Doctor and family among Air India crash victims | BBC News India,"news, republic, com, https, watch"
"Watch big political debates, exclusive entertainment interviews, news bulletins, current affairs, talk shows and tech reviews with our 24x7 news live streams, packed with credible information across all platforms: TV, Internet and Mobile.",37,Ahmedabad Plane Crash | Video Shows Moment Air India Ahmedabad-London Plane Crashed After Take Off,"news, republic, com, https, watch"
"Watch big political debates, exclusive entertainment interviews, news bulletins, current affairs, talk shows and tech reviews with our 24x7 news live streams, packed with credible information across all platforms: TV, Internet and Mobile.",37,Air India Plane Crash: What Is A Black Box In An Aircraft?,"news, republic, com, https, watch"
"-----------------------
About the channel
Watch us for the best news and views on business, stock markets, crypto currencies, consumer technology, the world of real estate, bullion, automobiles, start-ups and unicorns and  personal finance.",37,Live: Air India Ahmedabad?London Flight Crashes Minutes After Takeoff,"news, republic, com, https, watch"
"-------

Get more news at our site - https://www.channel4.com/news/ 

Follow us:
TikTok - https://www.tiktok.com/@c4news
Instagram - https://www.instagram.com/channel4news/
Twitter - https://twitter.com/Channel4News
Facebook - https://www.facebook.com/Channel4News/",37,British man survives Air India plane crash that kills 290,"news, republic, com, https, watch"
"Watch big political debates, exclusive entertainment interviews, news bulletins, current affairs, talk shows and tech reviews with our 24x7 news live streams, packed with credible information across all platforms: TV, Internet and Mobile.",37,BJ Medical College Ahmedabad | Pics Show Air India Plane Crashed On Medical Students' Hostel,"news, republic, com, https, watch"
"Watch big political debates, exclusive entertainment interviews, news bulletins, current affairs, talk shows and tech reviews with our 24x7 news live streams, packed with credible information across all platforms: TV, Internet and Mobile.",37,"Ahmedabad Plane Crash News | Air India Flight With 242 Onboard Crashes In Ahmedabad, No Survivors","news, republic, com, https, watch"
"For More News Updates, Visit : https://www.rtvlive.com
?",37,Air India Flight 171 Pilots Last Message??LIVE : Black BOx | Mayday Call | Ahmedabad Plane Crash |RTV,"news, republic, com, https, watch"
"We at RTV Network, favour high-quality programming and news, rather than sensational infotainment.",37,Air India Flight 171 Pilots Last Message??LIVE : Black BOx | Mayday Call | Ahmedabad Plane Crash |RTV,"news, republic, com, https, watch"
"https://www.facebook.com/RTVTeluguDigital/
Follow Us On Instagram:   https://www.instagram.com/rtvnewsnetwork/
Follow Us On Twitter:       https://twitter.com/RTVnewsnetwork",37,Air India Flight 171 Pilots Last Message??LIVE : Black BOx | Mayday Call | Ahmedabad Plane Crash |RTV,"news, republic, com, https, watch"
"Watch big political debates, exclusive entertainment interviews, news bulletins, current affairs, talk shows and tech reviews with our 24x7 news live streams, packed with credible information across all platforms: TV, Internet and Mobile.",37,Ahmedabad Plane Crash | Air India Cabin Crew's Grieving Family Speaks To NDTV,"news, republic, com, https, watch"
"Android: https://play.google.com/store/apps/details?id=com.phonegap.publictv&hl=en

iOS: https://apps.apple.com/in/app/public-tv-news/id1125391954

Keep Watching Us On Youtube At: https://www.youtube.com/user/publictvnewskannada
Watch More From This Playlist Here: https://www.youtube.com/user/publictvnewskannada/playlists



Read detailed news at www.publictv.in

Subscribe on YouTube: https://www.youtube.com/user/publictvnewskannada?sub_confirmation=1
Follow us on Google+ @  https://plus.google.com/+publictv
Like us @ https://www.facebook.com/publictv
Follow us on twitter @ https://twitter.com/PublicTVnews

--------------------------------------------------------------------------------------------------------
Public TV brings to you the latest updates from all walks of life, be it politics or entertainment, religion or sports, crime or any other thing.",37,Ahmedabad Plane Crash: One Survivor Found In Air India Flight | Public TV,"news, republic, com, https, watch"
"Dive into real-time news updates, insights, and much more.",37,'The door broke...': Lone survivor describes surviving Air India plane crash | Ahmedabad plane crash,"news, republic, com, https, watch"
"https://www.tiktok.com/@pressdemo 
----------
The Press Democrat delivers breaking local news, information, sports, entertainment, shopping, dining, weather and more for residents of Sonoma, Lake, Mendocino and Napa counties as well as real-time news from the Bay Area, the state, the nation and the world.",37,Wreckage at crash site as Air India flight crashes shortly after take off from Ahmedabad airport,"news, republic, com, https, watch"
"For more videos subscribe to our channel: https://www.youtube.com/@NDTVProfitIndia
Visit NDTV Profit for more news: https://www.ndtvprofit.com/
Don't enter the stock market unaware.",36,?Pilots Last Words Were??: Govt On Air India Flight Crash In Ahmedabad,"business, https, moneycontrol, com, news"
"You can support us by subscribing to our digital offerings here: https://bit.ly/3emywiz 

Follow us:",36,"Ahmedabad plane crash: Air India flight AI171 crashes, 242 on board","business, https, moneycontrol, com, news"
"Business Today TV will also bring you all you need to know about mutual funds, insurance, loans and pension plans among others.",36,Live: Air India Ahmedabad?London Flight Crashes Minutes After Takeoff,"business, https, moneycontrol, com, news"
"Moneycontrol is India?s leading financial portal, offering market news, expert analysis, and powerful tools.",36,Plane Crash in Ahmedabad Live:Air India Flight To London Crashes Moments After Take-Off In Ahmedabad,"business, https, moneycontrol, com, news"
"A part of Network18, moneycontrol.com is India?s most trusted destination for financial and business news.",36,Plane Crash in Ahmedabad Live:Air India Flight To London Crashes Moments After Take-Off In Ahmedabad,"business, https, moneycontrol, com, news"
"Subscribe: https://bit.ly/moneycontrolyoutube
Follow us:",36,Plane Crash in Ahmedabad Live:Air India Flight To London Crashes Moments After Take-Off In Ahmedabad,"business, https, moneycontrol, com, news"
"Visit https://www.moneycontrol.com/
Facebook: /moneycontrol
Twitter: /moneycontrolcom
Instagram: /moneycontrolcom",36,Plane Crash in Ahmedabad Live:Air India Flight To London Crashes Moments After Take-Off In Ahmedabad,"business, https, moneycontrol, com, news"
"Captain Summit Samarwal, with 8200 flying hours, and co-pilot Clive Kundar were among those who perished.",35,Air India Salutes its Fallen Comrades | Ahmedabad Airplane Crash News | India Today,"hours, pilot, captain, flight, clive"
"The cabin crew included 27-year-old Roshni Songhare, a travel influencer, and Deepak Pathak, an 11-year Air India veteran.",35,Air India Salutes its Fallen Comrades | Ahmedabad Airplane Crash News | India Today,"hours, pilot, captain, flight, clive"
The plane was being flown by Captain Sumeet Sabharwal and First Officer Clive Kundar.,35,Ahmedabad Plane Crash Live Updates: Rescue Operations Continue In Air India Disaster | India Today,"hours, pilot, captain, flight, clive"
"One was a veteran preparing to hang up his boots, the other a young co-pilot just charting the early course of his aviation career.",35,How Were Pilot's Last Moments Before Air India AI 171 Crash | Ahmedabad | India Today,"hours, pilot, captain, flight, clive"
"The pilot in command, Captain Sumit Sabharwal, had over 8,200 hours of flying experience.",35,"Ahmedabad plane crash: Air India flight AI171 crashes, 242 on board","hours, pilot, captain, flight, clive"
"The co-pilot had clocked in around 1,100 hours.",35,"Ahmedabad plane crash: Air India flight AI171 crashes, 242 on board","hours, pilot, captain, flight, clive"
"Dr Prateek Joshi, a radiologist at Royal Derby Hospital, his wife and three children were on board the flight, the Derby Hindu Temple in Pear Tree said.",35,Doctor and family among Air India crash victims | BBC News India,"hours, pilot, captain, flight, clive"
From a senior pilot just months away from retirement to a young woman who inspired her entire village ? the six crew members aboard the ill-fated Air India flight had stories that touched hearts.,35,"Air India Crash: The 6 Crew Members India Lost: Stories of Service, Dreams & Sacrifice","hours, pilot, captain, flight, clive"
"Captain Sabarwal, with 8200 hours of experience, was unable to save the flight.",35,"Air India Flight 171 Crashed, Leaving 241 Passengers And Crew Feared Dead | India Today News","hours, pilot, captain, flight, clive"
"One was a veteran preparing to hang up his boots, the other a young co-pilot just charting the early course of his aviation career.",35,How Were Pilot's Last Moments Before Air India AI 171 Crash | Ahmedabad | India Today,"hours, pilot, captain, flight, clive"
"#airindiacrash #ai171 #ahmedabadcrash #itwebvideos #aviationtragedy #airindia #dreamliner

Subscribe to India Today for NEW VIDEOS EVERY DAY and make sure to enable Push Notifications so you'll never miss a new video.",34,Air India Salutes its Fallen Comrades | Ahmedabad Airplane Crash News | India Today,"planecrash, new, subscribe, day make, enable"
"#ahmedabadplanecrash #aviationsafety #blackboxrecovery #itwebvideos #airindiablackbox #blackbox #pilotcommunication #aircraftemergency #aviationinvestigation

Subscribe to India Today for NEW VIDEOS EVERY DAY and make sure to enable Push Notifications so you'll never miss a new video.",34,Ahmedabad Plane Crash: Experts Decode Pilot's Last Words And Details Of Black Box | India Today,"planecrash, new, subscribe, day make, enable"
"#airindia171 #planecrash #ahmedabad #itwebvideos #lonesurvivor #airdisaster #dnatests #victimidentification

Subscribe to India Today for NEW VIDEOS EVERY DAY and make sure to enable Push Notifications so you'll never miss a new video.",34,Lone survivor of Air India 171 Crash Recounts Miraculous Escape | Ahmedabad Plane Crash,"planecrash, new, subscribe, day make, enable"
"#airindia #pilot #planecrash #itwebvideos #indiatoday #flightsafety #aircraftcrash #emergencyresponse #aviationincident #planecrash #london #ahemedabad #airindiacrash #aircraftcrash #airplane #boeing #tragedy #vijayrupani #plane #aviationincident #pilots #crashinvestigation #firstofficer #sumitsabharwal #vikrantmessy #airindiapilots

Subscribe to India Today for NEW VIDEOS EVERY DAY and make sure to enable Push Notifications so you'll never miss a new video.",34,How Were Pilot's Last Moments Before Air India AI 171 Crash | Ahmedabad | India Today,"planecrash, new, subscribe, day make, enable"
"#AirIndiaCrash #Boeing787 #AviationDisaster #PlaneCrash #NTSB #FAA #AviationInvestigation #AhmedabadCrash #ExplosiveCrash #AviationSafety 

Join ANI's YouTube membership to get access to perks:
https://www.youtube.com/channel/UCtFQDgA8J8_iiwc5-KoAQlg/join

Subscribe now and press the bell icon ??",34,US? NTSB and Boeing officials visit Air India AI-171 crash site in Ahmedabad,"planecrash, new, subscribe, day make, enable"
"#Ahmedabadplanecrash #ahmedabad   #airindia  #aI171 #planecrash  #aviationnews  #flightAI171 #ahmedabadairport  #breakingnews  #boeing787  #dreamlinercrash 

Thank you for watching our video!",34,"Ahmedabad plane crash: Air India flight AI171 crashes, 242 on board","planecrash, new, subscribe, day make, enable"
"#airindiacrash #planecrash #ahmedabadcrash #itwebvideos #miraclesurvivor #rescueoperation #gujarat
Subscribe to India Today for NEW VIDEOS EVERY DAY and make sure to enable Push Notifications",34,"Miracle Survivor, Ramesh,  Found In Air India Plane Crash, Jumped From Seat 11A | Ahmedabad Crash","planecrash, new, subscribe, day make, enable"
"#airindiaplanecrash #airindia #ahmedabadplanecrash #news18 


News18 Mobile App - https://onelink.to/desc-youtube",34,Pilot Sumit Sabharwal Issued A Mayday Minutes After Takeoff From Ahmedabad Airport | N18V,"planecrash, new, subscribe, day make, enable"
"#airindiacrash #ahmedabadplanecrash #planecrash 
#ahmedabadnews #planecrashnews #airindiaplanecrash 
#planecrashmoment #crashmoment #airindiaplanecrashmoment 
#planecrashvideo #airindiaplanecrashvideo #momentofplanecrash
#survivorsofplanecrash #planecrashsurvivors #airindiaplanecrashvictims 
#airindiasurvivor #causeofairindiacrash #whydidairindiaplanecrash 
#whydidairindiacrash #whatledtoairindiacrash #reasonforcrash 
#doctorfamily #victimsofaircrash #doctorfamilyaircrash #prateekjoshi




Click here to subscribe to our channel ????",34,Doctor and family among Air India crash victims | BBC News India,"planecrash, new, subscribe, day make, enable"
"#FlightCrashReport #AirSafetyIndia #CrashLandingLIVE #RescueOperation #AviationAlert #FlightEmergency #FlightFromIndia #BlackBoxSearch #LiveCrashUpdate #CNBCTV18Digital
#CNBCTV18 

??",34,Ahmedabad Plane Crash: First Visuals From Air India Flight Crash Site; Rescue Ops Underway | N18V,"planecrash, new, subscribe, day make, enable"
"#airindia #ahmedabadairport #aviationemergency #itwebvideos #indiatoday #flightsafety #aircraftcrash #emergencyresponse #aviationincident

Subscribe to India Today for NEW VIDEOS EVERY DAY and make sure to enable Push Notifications so you'll never miss a new video.",34,"Ahmedabad Plane Crash: Air India Flight Crashes Near Ahmedabad Airport, 242 Passengers On Board","planecrash, new, subscribe, day make, enable"
"#EmergencyResponse #CrashUpdate#IndianAviation 
-----------------------
Thank You for watching!",34,Live: Air India Ahmedabad?London Flight Crashes Minutes After Takeoff,"planecrash, new, subscribe, day make, enable"
"#airindiacrash #ahmedabadairport #aviationemergency #itwebvideos #indiatoday #flightsafety #aircraftcrash #emergencyresponse #aviationincident #planecrash #london #ahemedabad #airindiacrash #aircraftcrash #airplane #boeing #tragedy #vijayrupani #plane #aviationincident #ndrf #gujrat 

Subscribe to India Today for NEW VIDEOS EVERY DAY and make sure to enable Push Notifications",34,How Air India Flight Crashed Just After Take Off | Plane Crash | Ahmedabad | India Today,"planecrash, new, subscribe, day make, enable"
"#airindiacrash #ahmedabadcrash #planecrash #itwebvideos #aviationsafety #boeing787 #emergencyresponse
Subscribe to India Today for NEW VIDEOS EVERY DAY and make sure to enable Push Notifications so you'll never miss a new video.",34,Experts Discuss What May Have Caused The Crash Of Air India Plane In Ahmedabad Minutes After Takeoff,"planecrash, new, subscribe, day make, enable"
"#airindiaflight171 #planecrash #aviationdisaster #itwebvideos #indiatoday #airsafety #familytragedy #indiatoday

Subscribe to India Today for NEW VIDEOS EVERY DAY and make sure to enable Push Notifications so you'll never miss a new video.",34,"Air India Flight 171 Crashed, Leaving 241 Passengers And Crew Feared Dead | India Today News","planecrash, new, subscribe, day make, enable"
"#airindia #pilot #planecrash #itwebvideos #indiatoday #flightsafety #aircraftcrash #emergencyresponse #aviationincident #planecrash #london #ahemedabad #airindiacrash #aircraftcrash #airplane #boeing #tragedy #vijayrupani #plane #aviationincident #pilots #crashinvestigation #firstofficer #sumitsabharwal #vikrantmessy #airindiapilots

Subscribe to India Today for NEW VIDEOS EVERY DAY and make sure to enable Push Notifications so you'll never miss a new video.",34,How Were Pilot's Last Moments Before Air India AI 171 Crash | Ahmedabad | India Today,"planecrash, new, subscribe, day make, enable"
"#airindia  #planecrash  #ahmedabadcrash #breakingnews  #aviationnews  #indianews  #airIndiaaccident #ahmedabadairport  #ahmedabadplanecrash

Thank you for watching our video!",34,Air India Flight crashes near Ahmedabad airport #ahmedabadplanecrash,"planecrash, new, subscribe, day make, enable"
"#ahmedabadplanecrash #blackbox #blackboxrecovery #itwebvideos #ahmedabadnews #ahmedabadairplanecrash #ahmedabadcrash #gujaratnews #indiatoday #indiatodaynews 

Subscribe to India Today for NEW VIDEOS EVERY DAY and make sure to enable Push Notifications so you'll never miss a new video.",33,"Big Breakthrough in Ahmedabad Plane Crash Investigation, Black Box Of Air India 171 Plane Found","ahmedabadplanecrash, ahmedabadairportaccident, airindiacrash, new, ahmedabadrescueoperations"
"#ahmedabadrescueops #ndrfrescue #gujarattragedy #planecrashinahmedabadliveupdates #airindiacrash #ahmedabadplanecrash #ndrfrescue #britishcitizenscrash #planecrashinahmedabadliveupdates #ahmedabadplanecrash #planecrash #gujarattragedy #breakingnews2025 #gujarataplanecrash #airindiacrash #gujarattragedy 

Subscribe to India Today for NEW VIDEOS EVERY DAY and make sure to enable Push Notifications so you'll never miss a new video.",33,Ahmedabad Plane Crash Live Updates: Rescue Operations Continue In Air India Disaster | India Today,"ahmedabadplanecrash, ahmedabadairportaccident, airindiacrash, new, ahmedabadrescueoperations"
"#gujarat #ahmedabad #planecrash 

About Channel: 

WION",33,Ahmedabad Plane Crash | Air India Flight With 242 Crashes Into Students' Hostel | WION,"ahmedabadplanecrash, ahmedabadairportaccident, airindiacrash, new, ahmedabadrescueoperations"
"#ahmedabadplanecrash #airindia #ahmedabadnews #londonflight #ahmedabadairportaccident #ahmedabadrescueoperations #cnbctv18 #cnbctv18digital 

n18oc_india",33,BREAKING LIVE: London-Bound Air India Flight Crashes Near Ahmedabad | London Gatwick Flight News,"ahmedabadplanecrash, ahmedabadairportaccident, airindiacrash, new, ahmedabadrescueoperations"
"#ahmedabadplanecrash #ahmedabadflightcrash #ahmedabadplaneaccident #ahmedabadairportaccident #ahmedabadrescueoperations #cnbctv18 #cnbctv18digital 

n18oc_india",33,Ahmedabad Plane Crash LIVE | London-Bound Air India Flight Crashes Near Ahmedabad Airport | N18L,"ahmedabadplanecrash, ahmedabadairportaccident, airindiacrash, new, ahmedabadrescueoperations"
"#AhmedabadPlaneCrash #AirIndiaCrash #AhmedabadAirportAccident #AirIndiaFlightCrash #PassengerPlaneCrash #AhmedabadAviationIncident #AhmedabadPlaneAccidentNews #AhmedabadCrashCasualties #Ahmedabad242Passengers #ExclusivePlaneFootage #AirIndiaPlaneFell #AirportAccidentAhmedabad


n18oc_live
n18oc_world 

News18 Mobile App - https://onelink.to/desc-youtube",33,Ahmedabad Plane Crash LIVE Updates | Air India Flight Going To London Crashes | Plane Crash | N18L,"ahmedabadplanecrash, ahmedabadairportaccident, airindiacrash, new, ahmedabadrescueoperations"
"The airline confirmed that the flight carried 242 passengers and there was only one survivor, who was seated on 11A. It also said that a digital video recorder was found, but a search was on to find the black box after earlier reports suggested that it had been discovered.",32,Ahmedabad Plane Crash: What Air India Pilot's Final Words Could Mean? | What Is A Black Box?,"passengers, flight, 242, crew, onboard"
"The airline confirmed that the flight carried 242 passengers and there was only one survivor, who was seated on 11A. It also said that a digital video recorder was found, but a search was on to find the black box after earlier reports suggested that it had been discovered.",32,Ahmedabad Plane Crash: What Air India Pilot's Final Words Could Mean | India Today,"passengers, flight, 242, crew, onboard"
