sentence,cluster,title,cluster_label
ntsb; ntsb investigations; ntsb air crash investigation; ntsb air crash investigation today; plane crash survivor india; plane crash survivor; ahmedabad plane crash survivor; ahmedabad plane; ahmedabad plane crash; ahmedabad plane crash video; air india plane; air india plane crash; air india plane crash today; ahmedabad plane crash news; gujarat plane crash; gujarat plane crash news; ahmedabad news; ahmedabad flight crash news; ahmedabad flight crash; gujarat news.,6,Air India Ahmedabad Crash Veteran NTSB Investigator Greg Feith On What Videos Reveal,"crash, plane, plane crash, india, ahmedabad"
air india; air india plane crash; air india crash; plane crash; india plane crash; ahmedabad plane crash air india; air india crash ahmedabad; air india flight crash ahmedabad; gujarat plane crash; air india plane crash news; ahmedabad mein plane crash; indian plane crash; air india plane crash in ahmedabad; crash; gatwick india plane crash; air india plane fell; air india flight crash; why did plane crash; plane crash victims; plane crash victims family; bbc news india.,6,Doctor and family among Air India crash victims | BBC News India,"crash, plane, plane crash, india, ahmedabad"
ahmedabad plane crash; air india plane crash; plane crash; plane crash in ahmedabad; ahmedabad plane crash news; ahmedabad plane crash live; passenger plane crash in ahmedabad; plane crash in ahmedabad live updates; ahmedabad mein plane crash; plane crash in Ahmedabad; Plane Crashes In Gujarat Ahmedabad; Ahmedabad plane crash news; Ahmedabad Airport news; Air India plane crash; Air India Ahmedabad crash; Air India crash video; Why did AI171 crash; Air India AI171 crash.,6,Ahmedabad Plane Crash LIVE: Aviation Expert Captain Steve Discusses Theories Behind Air India Crash,"crash, plane, plane crash, india, ahmedabad"
2025; ahmedabad; ai 171; ai171; air india; air india crash; air india plane crash; boeing; boeing 787; boeing crash; canada; gatwick; guardian; gujarat; gujarat plane crash; india crash; india crash today; india latest; india news; india plane crash; india plane crash today; jet; jet plane crash; london; london gatwick; news; passenger plane crash; plane crash; plane crash in india; plane crash india; portugal; uk; world.,6,Smoke rises above Ahmedabad in first images from Air India plane crash,"crash, plane, plane crash, india, ahmedabad"
ahmedabad plane crash; plane crash in ahmedabad; air india plane crash; plane crash; plane crash news; plane crash ahmedabad; ahmedabad plane crash news; gujarat plane crash; air india crash ahmedabad; ahmedabad airport plane crash; plane crash in ahmedabad airport; ahmedabad plane crash 2025; ahmedabad mein plane crash; ahmedabad gujarat plane crash; ahmedabad plane crash live; plane crash in ahmedabad live updates; air india plane crash in ahmedabad; ahmedabadnews.,6,"Air India Boeing 787-8 Dreamliner Crashes In Ahmedabad: Over 200 Dead, One Miracle Survivor Emerges","crash, plane, plane crash, india, ahmedabad"
NDTV 24x7; breaking news; current affairs; latest news; live news; ndtv; ndtv live 24x7 english news; ndtv_news; top news; Plane Crash; Plane Crash In Ahmedabad; Ahmedabad Airport; Breaking News; Air India Plane Crash; category=news; Show=,6,Ahmedabad Plane Crash | Video Shows Moment Air India Ahmedabad-London Plane Crashed After Take Off,"crash, plane, plane crash, india, ahmedabad"
ahmedabad plane crash; air india plane crash; plane crash; plane crash in ahmedabad; ahmedabad plane crash news; passenger plane crash in ahmedabad; plane crash in ahmedabad live updates; ahmedabad mein plane crash; plane crash in Ahmedabad; Plane Crashes In Gujarat Ahmedabad; Ahmedabad plane crash news; Ahmedabad Airport news; Air India plane crash; Air India crash video; Why did AI171 crash; Air India AI171 crash; pm modi in gujarat; PM in ahmedabad; avaition ministry.,6,Aviation Ministry Press Briefing On  Ahmedabad Plane Crash  LIVE | Air India Plane Crash Updates,"crash, plane, plane crash, india, ahmedabad"
Gujarat plane crash; ahmedabad London flight; ahmedabad airport; ahmedabad emergency road sealed; ahmedabad plane crash; air india; air india plane; air india plane crash; aircraft crash; boeing 787; crash landing; emergency landing; emergency services; gujarat crash update; london flight; meghani nagar Gujarat; meghani nagar plane crash; passenger plane crash; plane cra; plane crash; plane crash Gujarat; residential area plane crash.,6,"Ahmedabad Plane Crash: Air India Flight Crashes Near Ahmedabad Airport, 242 Passengers On Board","crash, plane, plane crash, india, ahmedabad"
LIVE; Ahmedabad plane crash Air India; Ahmedabad airport accident today; Air India flight crash Ahmedabad; passenger plane crash Ahmedabad; Ahmedabad aviation incident; latest news Ahmedabad plane accident; casualties Ahmedabad plane crash; 242 passengers in Ahmedabad plane crash; exclusive footage Ahmedabad plane accident; Air India plane fell; airport accidentAhmedabad; air india; plane crash; ahmedabad plane crash; gujarat; plane crash in gujarat; plane crash live; wion live.,6,Ahmedabad Plane Crash LIVE: Reason Behind Air India Plane Crash Revealed? | Gujarat Plane Crash LIVE,"crash, plane, plane crash, india, ahmedabad"
ahmedabad plane crash; plane crash; plane crash ahmedabad; air india plane crash; air india crash; plane crash in ahmedabad; plane crash news; ahmedabad flight crash; ahmedabad plane crash today; ahmedabad news; plane crash today; air india crash today; air india flight; flight crash; ahmedabad airport; ahmedabad flight; air india plane crash today; ahmedabad crash; ahmedabad to london flight crash; ahemdabad plane crash; meghaninagar; breaking news; airplane crash.,6,Ahmedabad Plane Crash Shocking VIDEO: Moment Air India Flight With 242 People Crashes Near Ahmedabad,"crash, plane, plane crash, india, ahmedabad"
AnkitPrerecsFull_Merge; NDTV 24x7; breaking news; current affairs; latest news; live news; ndtv; ndtv live 24x7 english news; top news; Air India Crash; Ahmedabad Crash; Ahmedabad Plane Crash; India Dreamliner; Crash; Plane Crash; Ahmedabad; ndtv_news; Show=,6,Air India Plane Crash: What Is A Black Box In An Aircraft?,"crash, plane, plane crash, india, ahmedabad"
Business Today; Air India crash; Ahmedabad to London flight; plane crash; breaking news; aviation disaster; Ahmedabad news; Air India disaster; passenger flight crash; air safety; aircraft accident; crash after takeoff; rescue operation; Indian aviation; major plane crash; latest news; flight tragedy; Ahmedabad airport; London flight crash; aviation incident; air crash investigation; passenger news; crew safety; aviation emergency; developing news; crash details.,6,Live: Air India Ahmedabad?London Flight Crashes Minutes After Takeoff,"crash, plane, plane crash, india, ahmedabad"
india today; india today news; india today live; indian news live; india news live; english news; english news live; world news; top news; Gujarat plane crash; ahmedabad London flight; ahmedabad airport; ahmedabad plane crash; air india; air india plane; air india plane crash; aircraft crash; boeing 787; crash landing; emergency landing; emergency services; gujarat crash update; passenger plane crash; plane crash; plane crash Gujarat; residential area plane crash; crash.,6,How Air India Flight Crashed Just After Take Off | Plane Crash | Ahmedabad | India Today,"crash, plane, plane crash, india, ahmedabad"
firstpost; vantage; palki sharma; vantage palki sharma; first post; firstpost palki sharma; vantage on firstpost; ahmedabad plane crash; gujarat plane crash; ahmedabad London flight; plane crash Gujarat; indian plane crash; gujarat crash; passenger plane crash; Gujarat plane crash; meghani nagar Gujarat; residential area plane crash; meghani nagar plane crash; plane crash in ahmedabad; Ahmedabad aviation incident; airport accident Ahmedabad; ahmedabad mein plane crash; gujarat.,6,Boeing in Hot Water After Air India Plane Crash; Black Box Recovered | Vantage With Palki Sharma,"crash, plane, plane crash, india, ahmedabad"
"---

Air India crash | Ahmedabad plane crash | Gujarat air crash | Plane Crash | Air India London flight |  Ahmedabad London Flight | Meghani Nagar Gujarat | Ahmedabad airport | Firstpost",6,Boeing in Hot Water After Air India Plane Crash; Black Box Recovered | Vantage With Palki Sharma,"crash, plane, plane crash, india, ahmedabad"
latest news; Happening Now; CNN; India Plane Crash; Air India; Boeing 787,6,"At least one passenger survived the Air India crash, police say","crash, plane, plane crash, india, ahmedabad"
air india crash; air india crash survivor; air india crew; air india crew members; captain sumit samarwal; captain sumit sawarwal; air india flight; air india flight crash ahmedabad; ahmedabad plane; ahmedabad plane crash; ahmedabad plane crash video; air india plane; air india plane crash; air india plane crash today; ahmedabad plane crash news; gujarat plane crash; ahmedabad news; ahmedabad flight; ahmedabad flight crash; air india plane crash ahmedabad.,6,"Air India Crash: The 6 Crew Members India Lost: Stories of Service, Dreams & Sacrifice","crash, plane, plane crash, india, ahmedabad"
Ahmedabad plane crash; miracle survivor; plane crash survivor interview; India Today live; Air India crash; aviation disaster India; survivor speaks out; aircraft accident 2025; airplane crash survivor; aviation news live; Ahmedabad crash survivor; crash interview India; plane crash coverage; survivor story; India Today exclusive; aviation incident; Air India plane crash; Air India Ahmedabad crash; Air India crash video; Why did AI171 crash; Air India AI171 crash.,6,"Ahmedabad Plane Crash Survivor News Live | Air India Confirms 241 Passengers Killed, Only 1 Survivor","crash, plane, plane crash, india, ahmedabad"
Channel 4 News; latest news; world news; international news; one survivor; india plane crash survivor; india; india plane crash; india plane crash latest; india news; ahmedabad; ahmedabad crash; air india; air india crash; india latest; gatwick airport; c4news; channel 4 new; flight radar; meghani; modi; narendra modi; gujarat; air india plane crash; flight ai1717 crash; flight ai171.,6,British man survives Air India plane crash that kills 290,"crash, plane, plane crash, india, ahmedabad"
dd india doordarshan live dd india live tv dd india online stream; watch dd india live; DD INDIA 24*7; DD India; International news; Doordarshan; Air India crash; Air India plane crash 2025; Air India crash survivor; sole survivor Air India; Air India disaster; Ahmedabad plane crash; aviation accident India; British Indian survivor; plane crash investigation; Air India flight tragedy; aviation safety India; emergency response Air India crash.,6,Air India Plane Crash: 241 Killed ? Sole Survivor Breaks Silence on DD India,"crash, plane, plane crash, india, ahmedabad"
latest news; Happening Now; CNN; India Plane Crash; Air India; Boeing 787,6,Sole survivor of Air India crash describes the moments after impact,"crash, plane, plane crash, india, ahmedabad"
air india crash; air india crash today; air india crash ahmedabad; ahmedabad plane; ahmedabad plane crash; air india plane; air india plane crash; air india plane crash today; ahmedabad plane crash news; ahmedabad plane crash news today; gujarat plane crash; gujarat plane crash news; ahmedabad news; ahmedabad news live; ahmedabad flight news today; ahmedabad flight crash; air india plane crash news; gujarat news; jansatta; hindi news.,6,"Air India Crash: Black Box Recovered, PM Visits Site as Death Toll Reaches 265","crash, plane, plane crash, india, ahmedabad"
NDTV 24x7; breaking news; current affairs; latest news; live news; ndtv; ndtv live 24x7 english news; top news; Air India Flight; Air India Ahmedabad; Ahmedabad Airplane Crash; Air India Ahmedabad Crash; Air India Plane News; Air India Flight News Today; Show= NDTV Digital Originals; category= news; Digital Teaser; BJ Medical College Ahmedabad.,6,BJ Medical College Ahmedabad | Pics Show Air India Plane Crashed On Medical Students' Hostel,"crash, plane, plane crash, india, ahmedabad"
"---

Air India crash | Ahmedabad plane crash | Gujarat air crash | Plane Crash | Air India London flight |  Ahmedabad London Flight | Meghani Nagar Gujarat | Ahmedabad airport | Firstpost",6,"Air India Plane Crash LIVE: 265 Dead, Boeing Dreamliner's Black Box Recovered | Palki Sharma | N18G","crash, plane, plane crash, india, ahmedabad"
Ahmedabad Plane Crash; category= news; TV Clip; Air India Crash; Ahmedaba Crash; Ahmedabad Plane Crash.,6,"Ahmedabad Plane Crash News | Air India Flight With 242 Onboard Crashes In Ahmedabad, No Survivors","crash, plane, plane crash, india, ahmedabad"
ahmedabad plane crash; air india plane crash; plane crash news; gujarat plane crash; plane crash in ahmedabad; air india crash ahmedabad; plane crash in ahmedabad live updates; ahmedabad airport plane crash; ahmedabad plane crash news; india plane crash; plane crash in ahmedabad airport; ahmedabad airport plane crash live; plane crash ahmedabad; ahmedabad news; ahmedabad plane crash 2025; india today; air india flight; gujarati news channel live; news18 live; tv9 live.,6,BREAKING LIVE: London-Bound Air India Flight Crashes Near Ahmedabad | London Gatwick Flight News,"crash, plane, plane crash, india, ahmedabad"
air india; flight; plane crash; gatwick; sky news live; breaking; india plane crash; air india crash; gatwick crash; gatwick india plane crash.,6,British national survives Air India plane crash,"crash, plane, plane crash, india, ahmedabad"
ahmedabad plane crash; plane crash in ahmedabad; air india plane crash; plane crash; plane crash news; plane crash ahmedabad; ahmedabad plane crash news; gujarat plane crash; air india crash ahmedabad; ahmedabad airport plane crash; plane crash in ahmedabad airport; ahmedabad plane crash 2025; ahmedabad mein plane crash; ahmedabad gujarat plane crash; ahmedabad plane crash live; plane crash in ahmedabad live updates; air india plane crash in ahmedabad; ahmedabad news.,6,Experts Discuss What May Have Caused The Crash Of Air India Plane In Ahmedabad Minutes After Takeoff,"crash, plane, plane crash, india, ahmedabad"
air india crash; india air crash; india plane crash; ahmedabad; 2025; news; guardian; india plane crash today; plane crash; plane crash today; london gatwick; ahmedabad plane crash; ahmedabad crash; plane crash india; india air plane crash; plane crash india today; plane crash ahmedabad; india crash; narendra modi; modi; plane crash in india; air crash today; air crash ahmedabad; gatwick; air india; india; india news; portugal; canada; uk; indian plane crash; crash; the guardian; bang.,6,Air India flight to London Gatwick crashes in Ahmedabad,"crash, plane, plane crash, india, ahmedabad"
Modi; PM Modi Ahmedabad; ahmedabad news; ahmedabad plane crash; ahmedabad plane crash news; ahmedabad plane crash today; air india crash ahmedabad; air india plane crash; gujarat plane crash; passenger plane crash ahmedabad; plane crash; plane crash ahmedabad; plane crash in ahmedabad; plane crash in ahmedabad airport; plane crash in ahmedabad live updates; plane crash news; pm modi crash site; pm modi news; pm modi plane crash; pm modi speech.,6,"Air India Flight 171 Crashed, Leaving 241 Passengers And Crew Feared Dead | India Today News","crash, plane, plane crash, india, ahmedabad"
news; latest news; india news; news today; today news; ani news; news latest; top news; big news; hindi news; headlines; english news; breaking news; morning news; fast news; news india; trending news; news bulletin; world news; south asia news; international news; news9 live streaming; live stream; news9; ahmedabad; plane crash; plane crash in ahmebadad; gujrat; air india plane crash;,6,Ahmedabad Plane Crash | Air India Plane crash in Ahmedabad | News9 | LIVE,"crash, plane, plane crash, india, ahmedabad"
Hindi News; taja khabar; air india; air india crash; ahmedabad crash; ahmedabad plane crash; air india plane crash; gujarat teen viral airplane crash video; aryan asari airplane crash trauma; ahmedabad plane crash video analysis; aryan asari ahmedabad plane crash; air india planes inspection; boeing 787 inspection; boeing 787 dreamliner inspection; 787 inspection; ahmedabad air india plane crash; plane crash news; air india boeing 787; air india crash vide.,6,Air India Plane Crash  AI171 Crash Video ????? ???? Aryan Asari ?? ???? ?????? | Ahmedabad,"crash, plane, plane crash, india, ahmedabad"
"---

India | Air India | Air India Crash | Plane Crash | Indian Plane Crash | India Plane Crash | Gujarat Plane Crash | Ahmedabad Plane Crash | Plane Accident | Indian Plane Crash | Indian Plane Crash | Firstpost | News Live | World News | Latest News | Global News |",6,Watch: Moment Air India Plane Crashed in Ahmedabad | Subscribe to Firstpost | N18G,"crash, plane, plane crash, india, ahmedabad"
india today; india today news; india today live; indian news live; india news live; english news; english news live; world news; top news; Gujarat plane crash; ahmedabad London flight; ahmedabad airport; ahmedabad plane crash; air india; air india plane; air india plane crash; aircraft crash; boeing 787; crash landing; emergency landing; gujarat crash update; plane crash; plane crash Gujarat; sumit sabarwal pilot; first officer; pilots; air india pilots; Clive Kunder.,6,How Were Pilot's Last Moments Before Air India AI 171 Crash | Ahmedabad | India Today,"crash, plane, plane crash, india, ahmedabad"
NDTV 24x7; breaking news; current affairs; latest news; live news; ndtv; ndtv live 24x7 english news; top news; gopi_intvw_157251; Air India Flight; Air India Ahmedabad; Ahmedabad Airplane Crash; Air India Ahmedabad Crash; Air India Plane News; Air India Flight News Today; Show= NDTV Digital Originals; category= news; Digital Teaser.,6,Ahmedabad Plane Crash | Air India Cabin Crew's Grieving Family Speaks To NDTV,"crash, plane, plane crash, india, ahmedabad"
Public TV; Public TV Kannada; Kannada news channel; kannada news; HR Ranganath; Public TV Kannada news; Public TV Kannada Live; Air India Plane Crash; air india flight; air india flight crash today; air india flight crash in ahmedabad; air india flight crash news; air india flight crash video; air india flight crash gujarat; vishwas kumar ramesh; air india crash survivor; air india.,6,Ahmedabad Plane Crash: One Survivor Found In Air India Flight | Public TV,"crash, plane, plane crash, india, ahmedabad"
2025; ahmedabad; ahmedabad crash; ai 171; ai171; air india; air india crash; air india flight 171; air india flight crash; air india plane crash; boeing; cctv; dreamliner; flight 171; guardian; india; india crash; india plane crash; india plane crash 2025; india plane crash cctv; indian plane crash; jet plane crash; jumbo; jumbo jet crash; london gatwick; news; plane crash; plane crash cctv; plane crash india; plane crash today; plane crash caught on camera; cctv footage; indian; fly.,6,CCTV footage shows moment Air India plane crashes in Ahmedabad,"crash, plane, plane crash, india, ahmedabad"
Business Standard; BS News; Business News; Financial News; News; Daily News; share market; stock market; share market live; investment; political news; national news; live news; seat 11a survivor; seat 11 a miracle; seat 11 a plane crash; seat 11 a kaise bacha; seat 11 a passenger.,6,'The door broke...': Lone survivor describes surviving Air India plane crash | Ahmedabad plane crash,"crash, plane, plane crash, india, ahmedabad"
sonoma; napa; lake county; mendocino; news; local news; sports; dining; bay area; weather; breaking news; entertainment; shopping; information.,6,Wreckage at crash site as Air India flight crashes shortly after take off from Ahmedabad airport,"crash, plane, plane crash, india, ahmedabad"
ahmedabad plane crash; air india plane crash; plane crash in ahmedabad; plane crash; air india crash ahmedabad; gujarat plane crash; ahmedabad plane crash air india; air india plane crash in ahmedabad; air india flight crash ahmedabad; plane crash in ahmedabad airport; ahmedabad plane crash news; ahmedabad plane crash 2025; ahmedabad mein plane crash; air india plane prash; air india crash; plane crash news; air india; ahmedabad gujarat plane crash; india plane crash.,6,Ahmedabad Plane Crash Kills Over 260 People: World Mourns Air India's Major Tragedy | WATCH,"crash, plane, plane crash, india, ahmedabad"
2025; ahmedabad; ai171; air india 171; air india crash; air india flight crash; air india plane crash; air plane crash; boeing; boeing dreamliner; canada; dreamliner; flight; flight 171; gatwick; guardian; india; india air crash; india air plane crash; india crash; india plane crash; india plane crash site; india plane crash today; london gatwick; meghani nagar; news; plane; plane crash; plane crash site; portugal; uk; air india crash site; air india crash today; plane crash today; boeings.,6,Footage shows aftermath at Air India flight 171 crash site,"crash, plane, plane crash, india, ahmedabad"
air india; ahmedabad plane crash; vijay rupani; plane crash; plane crash ahmedabad; air india crash; air india plane crash; air india flight crash; ahmedabad; news; ahmedabad flight crash; plane crash news; plane crash in ahmedabad; flight crash; air india flight; ai 171; ahmedabad news; air india news; ai171; ahmedabad plane crash today; plane crash today; ahmedabad flight; latest news; air india crash today; news today.,6,Ahmedabad Plane Crash | One Survivor Found | Air India Plane Crash | News9,"crash, plane, plane crash, india, ahmedabad"
ahmedabad plane; ahmedabad plane crash; ahmedabad plane crash news; ahmedabad plane crash live; ahmedabad mein plane crash; ahmedabad plane crash news today; gujarat plane crash; gujarat plane crash news; gujarat plane crash video; gujarat plane crash hadsa; ahmedabad news; ahmedabad news live; ahmedabad flight news today; ahmedabad flight crash; air india plane crash; air india plane crash today; air india plane crash news; gujarati news live; gujarat news plane crash.,6,Moment When Air India Dreamliner Crashed | Ahmedabad plane crash | Exact Moment Plane Crashed,"crash, plane, plane crash, india, ahmedabad"
Air India plane crash 2025; AI 171 crash Ahmedabad; Meghaninagar plane crash; Air India flight AI 171 accident; Ahmedabad airport crash May 12; Air India news today; plane crash India 2025; aviation accident India; Air India emergency landing; Air India crash fire; breaking news India; Gujarat flight crash; Air India London flight crash; latest aviation news India; ahmedabad plane crash; gujarat plane crash; air india plane crash.,6,Air India Flight crashes near Ahmedabad airport #ahmedabadplanecrash,"crash, plane, plane crash, india, ahmedabad"
| N18L. Ahmedabad plane crash Air India; Ahmedabad airport accident today; Air India flight crash Ahmedabad; passenger plane crash Ahmedabad; Ahmedabad aviation incident; latest news Ahmedabad plane accident; casualties Ahmedabad plane crash; 242 passengers in Ahmedabad plane crash; exclusive footage Ahmedabad plane accident; Air India plane fell; airport accidentAhmedabad; plane crash news; ahmedabad news; plane crash today.,6,Ahmedabad Plane Crash LIVE Updates | Air India Flight Going To London Crashes | Plane Crash | N18L,"crash, plane, plane crash, india, ahmedabad"
moneycontrol; moneycontrol live; live news; breaking news; arnab debates; debate with arnab; arnab goswami; gujarat news; ahmedabad news; ahmedabad plane crash; gujarat plane crash; air india plane crash; pm modi live; amit shah live; ahmedabad latest news; gujarat police; gujarat airport; ahmedabad airport; plane crash live; air india's plane crash live; shocking plane crash live; live tv; india news; latest news; trending news; kutch; ghoda camp.,6,Plane Crash in Ahmedabad Live:Air India Flight To London Crashes Moments After Take-Off In Ahmedabad,"crash, plane, plane crash, india, ahmedabad"
Modi | Narendra Modi | India | Air India | Air India Crash | Plane Crash | Indian Plane Crash | India Plane Crash | Gujarat Plane Crash | Ahmedabad Plane Crash | Plane Accident | Indian Plane Crash | Indian Plane Crash | Firstpost Spotlight,6,"Ahmedabad: PM Modi Visits Air India Boeing-787 Plane Crash Site, Meets Survivor | Spotlight | N18G","crash, plane, plane crash, india, ahmedabad"
"https://bit.ly/3EPZ6xF
R.Explained ?",5,Ahmedabad Plane Crash: 2nd Black Box Recovered Of Air India Flight AI 171 From Crash Site,"explained, https, com, com playlist, express"
It's Complicated ?,5,"At least one survivor from Air India plane crash, Ahmedabad police say","explained, https, com, com playlist, express"
"Express Explained In 60 Seconds - https://youtube.com/playlist?list=PLrDg7LoYgk9wf6MYiN9rR3zN3f-lWmfaS
??",5,The Moment an Air India Flight Crashed Near Ahmedabad Airport,"explained, https, com, com playlist, express"
"Indian Express Explained - https://youtube.com/playlist?list=PLrDg7LoYgk9y8Wm50M57nutw5usWUkb-k
??",5,The Moment an Air India Flight Crashed Near Ahmedabad Airport,"explained, https, com, com playlist, express"
"Express Explained In 60 Seconds - https://youtube.com/playlist?list=PLrDg7LoYgk9wf6MYiN9rR3zN3f-lWmfaS
??",5,Air India Ahmedabad Crash Veteran NTSB Investigator Greg Feith On What Videos Reveal,"explained, https, com, com playlist, express"
"Indian Express Explained - https://youtube.com/playlist?list=PLrDg7LoYgk9y8Wm50M57nutw5usWUkb-k
??",5,Air India Ahmedabad Crash Veteran NTSB Investigator Greg Feith On What Videos Reveal,"explained, https, com, com playlist, express"
It's Complicated ?,5,Smoke rises above Ahmedabad in first images from Air India plane crash,"explained, https, com, com playlist, express"
"Express Explained In 60 Seconds - https://youtube.com/playlist?list=PLrDg7LoYgk9wf6MYiN9rR3zN3f-lWmfaS
??",5,"Air India Crash: The 6 Crew Members India Lost: Stories of Service, Dreams & Sacrifice","explained, https, com, com playlist, express"
